name,address,type
Rebel Field,,Museum
Our Lady of Mercy Catholic Cemetery,,Museum
Mer-Tex Cafe,Mercedes,Museum
The Weslaco Museum,Weslaco,Museum
McHenry Tichenor Museum Project,La Feria,Museum
Donna Hooks Fletcher Museum,Donna,Museum
Alamo Museum,Alamo,Museum
Texas Conjunto Music Hall,San Benito,Museum
Museums of San Benito,San Benito,Museum
International Museum of Art & Science,McAllen,Museum
Alamo Museum,Alamo,Museum
Edinburg Scenic Wetlands and World Birding Center,Edinburg,Museum
Gonzales Munoz Family Cemetery,Donna,Museum
Witch House Small Salem,,Museum
Rancho de Carricitos historic marker,,Museum
Stone Wall Jackson Hotel,San Benito,Museum
"Little MEMPHIS in San Benito, TX",San Benito,Museum
Handy Family Cemetery,,Museum
San Benito Cultural Heritage Museum,San Benito,Museum
The Bryan House,Mission,Museum
Alexander,San Benito,Museum
Harlingen Cultural Arts Center,Harlingen,Museum
Freddy Fender Museum,San Benito,Local history museum
Museum of South Texas History,Edinburg,History museum
The Harlingen Arts and Heritage Museum,Harlingen,Museum
