name,address,type
Millville Army Air Field Museum,Millville,Museum
Museum of American Glass,Millville,Museum
Wheaton Arts,Millville,Non-profit organization
Buckshutem Wildlife Management Area,Millville,Museum
Vineland Historical Society,Vineland,Museum
Cemetery on Academy St.,Millville,Museum
Woodruff Museum of Indian,Bridgeton,Museum
Bridgeton Hall of Fame,Bridgeton,Museum
Seabrook Educational and Cultural Center,Bridgeton,Museum
Gouldtown Memorial Park (CEMETERY) DaddyGust,Bridgeton,Museum
Nail House Museum,Bridgeton,Museum
Bayshore Center at Bivalve,Port Norris,Museum
Bateman Memorial Cemetery,Newport,Museum
New Sweden Farmstead Museum,,Open air museum
Ronald McDonald Fun House,Dorothy,Museum
