name,address,type
Garden Grove Historical Society,12174 S Euclid St,Museum
Westminster Museum,8612 Westminster Blvd,Museum
Garden Grove Historical Society,Euclid St,Museum
Museum of the Republic of Vietnam,9842 Bolsa Ave b106,Museum
Walt Disney's Garage,,Historical place museum
ORANGE COUNTY MOTORCYCLE CLUB,11500 Trask Ave,Historical place museum
Hilbert Museum of California Art,167 N Atchison St,Museum
Viện Bảo Tàng Lịch Sử QLVNCH,9842 Bolsa Ave,Museum
Bowers Museum,2002 N Main St,Museum
Discovery Cube Orange County,2500 N Main St,Science museum
Muzeo Museum and Cultural Center,241 S Anaheim Blvd,Museum
Heritage Museum of Orange County,3101 W Harvard St,Museum
Kidseum,1802 N Main St,Art museum
The Dr. Willella Howe-Waffle House and Medical Museum,120 W Civic Center Dr,Museum
Jewelry GomldtraderMira,5277 Katella Ave,Museum
Walt Disney Apartment,105 Main Street U.S.A.,Historical place museum
Old Orange County Courthouse,211 W Santa Ana Blvd,Museum
Great Scott the Glad Scientist,,Entertainer
Museum Quality Restoration Services,,Museum
Church,309 N Manchester Ave,Museum
Los Alamitos Museum Association,11062 Los Alamitos Blvd,Museum
Boeing Co. C13,15400 Graham St,Museum
Rancho Los Alamitos Historic Ranch and Gardens,6400 E Bixby Hill Rd,History museum
Buena Park Historical Society,6631 Beach Blvd,Museum
Bluelot Santa Ana Orange County Graffiti,201 E First St,Art museum
Marconi Automotive Museum,1302 Industrial Dr,Museum
